[2024-12-06, 17:51:44] tcpdump -w caps/3.13.2.2-capture-tls-outer.pcap -i eth0 port 25 --print -A -l
tcpdump: listening on eth0, link-type EN10MB (Ethernet), snapshot length 262144 bytes
17:51:50.779506 IP6 vit100.36866 > lm000.lab.it.uc3m.es.smtp: Flags [S], seq 446433224, win 64800, options [mss 1440,sackOK,TS val 2158226862 ecr 0], length 0
`.,..$.@ .. ...
.......P .. ...........)............... .>.........
........
17:51:50.780352 IP6 lm000.lab.it.uc3m.es.smtp > vit100.36866: Flags [S.], seq 790772269, ack 446433225, win 64260, options [mss 1440,sackOK,TS val 1478819837 ecr 2158226862], length 0
`
...$.? .. ...........) .. ...
.......P..../":-...................
X$......
17:51:50.780377 IP6 vit100.36866 > lm000.lab.it.uc3m.es.smtp: Flags [.], ack 1, win 64800, options [nop,nop,TS val 2158226863 ecr 1478819837], length 0
`.,.. .@ .. ...
.......P .. ...........)......../":.... .e.....
....X$..
17:51:50.782155 IP6 lm000.lab.it.uc3m.es.smtp > vit100.36866: Flags [P.], seq 1:54, ack 1, win 64260, options [nop,nop,TS val 1478819839 ecr 2158226863], length 53: SMTP: 220 lm000.lab.it.uc3m.es ESMTP Postfix (Debian/GNU)
`
...U.? .. ...........) .. ...
.......P..../":.........FA.....
X$......220 lm000.lab.it.uc3m.es ESMTP Postfix (Debian/GNU)

17:51:50.782165 IP6 vit100.36866 > lm000.lab.it.uc3m.es.smtp: Flags [.], ack 54, win 64747, options [nop,nop,TS val 2158226865 ecr 1478819839], length 0
`.,.. .@ .. ...
.......P .. ...........)......../":c.....a.....
....X$..
17:51:50.782265 IP6 vit100.36866 > lm000.lab.it.uc3m.es.smtp: Flags [P.], seq 1:29, ack 54, win 64747, options [nop,nop,TS val 2158226865 ecr 1478819839], length 28: SMTP: EHLO vit100.lab.it.uc3m.es
`.,..<.@ .. ...
.......P .. ...........)......../":c...........
....X$..EHLO vit100.lab.it.uc3m.es

17:51:50.782788 IP6 lm000.lab.it.uc3m.es.smtp > vit100.36866: Flags [.], ack 29, win 64232, options [nop,nop,TS val 1478819840 ecr 2158226865], length 0
`
... .? .. ...........) .. ...
.......P..../":c........ G.....
X%......
17:51:50.783017 IP6 lm000.lab.it.uc3m.es.smtp > vit100.36866: Flags [P.], seq 54:211, ack 29, win 64232, options [nop,nop,TS val 1478819840 ecr 2158226865], length 157: SMTP: 250-lm000.lab.it.uc3m.es
`
.....? .. ...........) .. ...
.......P..../":c........E......
X%......250-lm000.lab.it.uc3m.es
250-PIPELINING
250-SIZE 10240000
250-VRFY
250-ETRN
250-STARTTLS
250-ENHANCEDSTATUSCODES
250-8BITMIME
250-DSN
250 CHUNKING

17:51:50.783124 IP6 vit100.36866 > lm000.lab.it.uc3m.es.smtp: Flags [P.], seq 29:150, ack 211, win 64590, options [nop,nop,TS val 2158226866 ecr 1478819840], length 121: SMTP: MAIL FROM:<<uid>@lab.it.uc3m.es> SIZE=451
`.,....@ .. ...
.......P .. ...........)......../";....Nz......
....X%..MAIL FROM:<<uid>@lab.it.uc3m.es> SIZE=451
RCPT TO:<<uid>@lab.it.uc3m.es> ORCPT=rfc822;<uid>@lab.it.uc3m.es
DATA

17:51:50.816428 IP6 lm000.lab.it.uc3m.es.smtp > vit100.36866: Flags [P.], seq 211:276, ack 150, win 64111, options [nop,nop,TS val 1478819873 ecr 2158226866], length 65: SMTP: 250 2.1.0 Ok
`
...a.? .. ...........) .. ...
.......P..../";....^...oD......
X%.!....250 2.1.0 Ok
250 2.1.5 Ok
354 End data with <CR><LF>.<CR><LF>

17:51:50.816536 IP6 vit100.36866 > lm000.lab.it.uc3m.es.smtp: Flags [P.], seq 150:610, ack 276, win 64525, options [nop,nop,TS val 2158226899 ecr 1478819873], length 460: SMTP: Received: from localhost (localhost [127.0.0.1])
`.,....@ .. ...
.......P .. ...........).......^/";A....[......
....X%.!Received: from localhost (localhost [127.0.0.1])
	by vit100.lab.it.uc3m.es (Postfix) with ESMTPS id B4439280336
	for <<uid>@lab.it.uc3m.es>; Fri,  6 Dec 2024 17:51:50 +0100 (CET)
From: <uid>@lab.it.uc3m.es
To: <uid>@lab.it.uc3m.es
Subject: Test with TLS
Message-Id: <20241206165150.B4439280336@vit100.lab.it.uc3m.es>
Date: Fri,  6 Dec 2024 17:51:50 +0100 (CET)

This is an email sent with TLS encryption between SMTP server and client
.
QUIT

17:51:50.859715 IP6 lm000.lab.it.uc3m.es.smtp > vit100.36866: Flags [.], ack 610, win 63784, options [nop,nop,TS val 1478819917 ecr 2158226899], length 0
`
... .? .. ...........) .. ...
.......P..../";A..
*...(.u.....
X%.M....
17:51:50.871121 IP6 lm000.lab.it.uc3m.es.smtp > vit100.36866: Flags [P.], seq 276:328, ack 610, win 63784, options [nop,nop,TS val 1478819928 ecr 2158226899], length 52: SMTP: 250 2.0.0 Ok: queued as C6EB84A0104
`
...T.? .. ...........) .. ...
.......P..../";A..
*...(	>.....
X%.X....250 2.0.0 Ok: queued as C6EB84A0104
221 2.0.0 Bye

17:51:50.871251 IP6 vit100.36866 > lm000.lab.it.uc3m.es.smtp: Flags [F.], seq 610, ack 328, win 64473, options [nop,nop,TS val 2158226954 ecr 1478819928], length 0
`.,.. .@ .. ...
.......P .. ...........)......
*/";u.....M.....
...
X%.X
17:51:50.871657 IP6 lm000.lab.it.uc3m.es.smtp > vit100.36866: Flags [.], ack 611, win 63784, options [nop,nop,TS val 1478819929 ecr 2158226954], length 0
`
... .? .. ...........) .. ...
.......P..../";v..
+...(.......
X%.Y...

17:51:51.075789 IP6 lm000.lab.it.uc3m.es.smtp > vit100.36866: Flags [FP.], seq 328, ack 611, win 63784, options [nop,nop,TS val 1478820133 ecr 2158226954], length 0
`
... .? .. ...........) .. ...
.......P..../";u..
+...(.(.....
X%.%...

17:51:51.075817 IP6 vit100.36866 > lm000.lab.it.uc3m.es.smtp: Flags [.], ack 329, win 64473, options [nop,nop,TS val 2158227159 ecr 1478820133], length 0
`.,.. .@ .. ...
.......P .. ...........)......
+/";v...........
....X%.%
17 packets captured
17 packets received by filter
0 packets dropped by kernel
